id,title,body,is_active,created_at
1,Tình yêu là sự thấu hiểu,"Đôi khi không cần nói quá nhiều, chỉ cần lắng nghe nhau bằng cả trái tim đã đủ để hiểu được đối phương.",true,2025-10-31 13:31:01.784701+00
2,Khoảng cách không phải là vấn đề,"Nếu hai người thật sự hướng về nhau, dù xa cách bao nhiêu, trái tim vẫn sẽ tìm được đường để gặp lại.",true,2025-10-31 13:31:26.731006+00
3,Yêu là chấp nhận cả những khuyết điểm,Không ai hoàn hảo cả. Tình yêu thật sự là khi bạn thấy rõ điểm yếu của người kia nhưng vẫn muốn ở lại.,true,2025-10-31 13:31:51.251803+00
4,Đừng quên yêu chính mình,"Trước khi yêu người khác, hãy học cách yêu bản thân. Một trái tim đủ đầy mới có thể chia sẻ tình yêu chân thành.",true,2025-10-31 13:32:18.204331+00
5,"Tình yêu không cần hoàn hảo, chỉ cần chân thành","Những điều nhỏ bé, chân thật hằng ngày mới là thứ nuôi dưỡng tình cảm bền lâu hơn mọi lời hứa hẹn.",true,2025-10-31 13:32:50.881504+00